{
  "schema_version": 1,
  "experiment_id": "bull:momentum-filter:001",
  "owner": "bull",
  "status": "DRAFT",
  "created_at": "2026-07-16T12:00:00Z",
  "source_lineage": [
    {
      "repository": "https://github.com/chrisworsey55/atlas-gic",
      "commit": "fcfc40dcf628f6af091c28cb2c33827f42cef8fd",
      "source_paths": ["architecture/autoresearch.md"],
      "concept": "Evaluate one isolated research change through a reversible champion-challenger process."
    }
  ],
  "hypothesis": {
    "claim": "A lagged relative-strength filter may reduce entries during persistent sector weakness.",
    "causal_mechanism": "Sector-relative momentum may proxy for information diffusion and avoid fighting broad institutional flows.",
    "expected_failure_mode": "The filter may enter late, increase turnover, and underperform during sharp mean-reversion regimes."
  },
  "single_change": {
    "target": "Inactive candidate-ranking research model",
    "baseline_commit": "UNKNOWN",
    "baseline_artifact_sha256": "UNKNOWN",
    "proposed_diff": "Add one lagged sector-relative momentum term; do not change any other feature or threshold."
  },
  "signal": {
    "equation": "score_new = score_baseline + beta * zscore(lagged_20d_stock_return - lagged_20d_sector_return)",
    "inputs": [
      {
        "name": "lagged_relative_return_20d",
        "definition": "Twenty-session total return minus the canonical sector ETF total return, both ending before decision time.",
        "availability_lag": "Use only prices available at the prior official close; no same-session close leakage.",
        "source": "Point-in-time split- and dividend-adjusted prices from the approved research dataset."
      }
    ],
    "universe": "Human-approved US-equity instrument universe only.",
    "exclusions": ["Exclude records lacking point-in-time sector membership or complete corporate-action history."],
    "horizon": "Evaluate forward excess return over five and twenty trading sessions.",
    "rebalance": "Recompute once per official market session after the close.",
    "execution_lag": "Earliest simulated execution is the next tradable session with explicit spread and impact costs."
  },
  "data": {
    "snapshot_id": "UNKNOWN",
    "snapshot_sha256": "UNKNOWN",
    "as_of_cutoff": "UNKNOWN",
    "point_in_time": "UNKNOWN",
    "survivorship_free": "UNKNOWN",
    "corporate_action_policy": "UNKNOWN until splits, dividends, delistings, symbol changes, and membership changes are specified.",
    "train_window": "UNKNOWN",
    "validation_window": "UNKNOWN",
    "untouched_test_window": "UNKNOWN",
    "purge_days": "UNKNOWN",
    "embargo_days": "UNKNOWN"
  },
  "evaluation": {
    "benchmark": "SPY total return plus the unchanged baseline model",
    "primary_metric": "Draft primary metric: out-of-sample information ratio of net excess returns.",
    "minimum_effect": "UNKNOWN until a practically meaningful effect and confidence threshold are set before testing.",
    "sample_floor": "UNKNOWN",
    "cost_model": "Include commissions, bid-ask spread, market impact, delayed or failed fills, and taxes when applicable.",
    "turnover_limit": "UNKNOWN until the baseline turnover and realistic capacity are measured.",
    "capacity_assumption": "UNKNOWN until ADV, participation rate, and position-size constraints are measured.",
    "uncertainty_method": "Draft a dependence-aware bootstrap confidence interval method before any testing begins.",
    "multiple_testing_family": "Count this candidate with every related feature, horizon, threshold, and regime tried in the same research family.",
    "dependence_control": "Purge overlapping labels, embargo adjacent folds, and avoid treating overlapping horizons as independent samples.",
    "regime_slices": ["Bull/low-volatility", "Crisis", "Rate-tightening", "Recovery", "Euphoria"],
    "parameter_sensitivity": "Evaluate a pre-declared beta grid and neighboring lookbacks without selecting a single lucky peak."
  },
  "shadow_plan": {
    "minimum_sessions": "UNKNOWN",
    "minimum_decisions": "UNKNOWN",
    "acceptance_rule": "UNKNOWN until the test metric, sample floor, and operational failure budget are frozen.",
    "no_test_reuse": true
  },
  "rollback": {
    "trigger": "Reject on data leakage, schema drift, material cost-model miss, or failure of the frozen reviewed acceptance rule.",
    "maximum_drawdown": "UNKNOWN until a shadow drawdown budget is approved by the human operator.",
    "data_quality_trigger": "Reject if point-in-time integrity, symbol history, or corporate-action coverage cannot be demonstrated."
  },
  "human_review": {
    "required": true,
    "decision": "PENDING",
    "reviewer": null,
    "reviewed_at": null
  }
}
